q_type,question,answer
condition,What is placental insufficiency?,Placental insufficiency is impaired blood flow to the placenta resulting in a reduction in a decline in the delivery of nutrients and oxygen to the developing fetus.
symptom,Are there always obvious symptoms of a blood clot?,"No, about half of all people with deep vein thrombosis have no detectable symptoms."
condition,What is deep vein thrombosis?,"It is a type of blood clot, often without detectable symptoms."
treatment,What is recommended to prevent blood clots after surgery?,"Moving around again as soon as possible is recommended, especially after bed rest or lying down in recovery."
treatment,What should someone taking an anticoagulant wear?,They should wear a medical identification bracelet or necklace noting the type of anticoagulant they are taking.
contraindication,What are some reasons a person might have a contraindication to anticoagulation?,Recent surgery or a history of a brain bleed.
condition,What condition might lead to a need to stop anticoagulation?,Metastatic cancer.
complication,What conditions make someone vulnerable to fatal complications if another PE occurs?,Significant heart or lung problems.
procedure,What is IVC filter placement?,It is a minimally invasive procedure where a catheter containing a collapsed filter is threaded through a small cut in the groin and attached to the walls of the inferior vena cava.
mortality_rate,What was the 28-day mortality rate for critically ill people with DIC in 2017?,36%
mortality_rate,What was the 28-day mortality rate for critically ill people with DIC in 2010?,Nearly 42%
mortality_rate_reason,Why did the mortality rate for DIC decline from 2010 to 2017?,Advances in DIC therapies and changes in DIC-related care strategies.
emergency_care,When should someone seek emergency medical attention for bleeding?,"If they cannot control their bleeding with direct pressure, are losing a large amount of blood, or have severe joint swelling and pain."
dic_cause,What triggers Disseminated Intravascular Coagulation (DIC)?,"An underlying health issue such as a severe infection, trauma, or cancer."
dic_location,Where are people with DIC most often hospitalized?,In the intensive care unit (ICU).
blood_clotting,What are blood clots?,Plugs created by platelets and various proteins at the site of blood vessel injury.
vwd_effect,What does Von Willebrand disease prevent?,It prevents your blood from clotting correctly or quickly.
vwd_symptoms,What are some symptoms of Von Willebrand disease?,"Spontaneous nosebleeds, easy bruising, and/or heavy menstrual periods."
blood_donation,How quickly does plasma replenish after donation?,Plasma can quickly replenish within 24 hours.
blood_donation,How long does it take for red blood cell levels to return to normal after donation?,Red blood cell levels take up to six weeks to return to normal.
blood_donation,What are some potential side effects immediately after blood donation?,"It is possible to have some bleeding at the needle site, but applying pressure and raising your arm will stop the bleeding. You may also later experience bruising at the site."
blood_donation,How long should you stay at the blood donation center after donating?,You should stay at the blood donation center for at least 15 minutes after you donate so you can be monitored for side effects.
blood_donation,What should you do if you experience severe side effects after leaving the donation center?,"If you experience severe side effects after leaving the donation center, seek medical care as soon as possible."
blood_donation,What is plasma used for?,"Plasma can be used by hospitals in emergency situations. Components made from plasma are essential for treating several medical conditions, including bleeding disorders and immunodeficiency."
blood_donation,How often can you donate whole blood?,"A whole blood donation can be made every 56 days, or six times yearly."
blood_donation,What is a Power Red blood donation?,"A Power Red blood donation, also called a double red cell donation, collects two units of red blood cells."
blood_donation,How often can you donate with a Power Red blood donation?,"With a Power Red blood donation, you can donate every 112 days, up to three times a year."
blood_donation,What blood types are urged to make Power Red donations?,"The American Red Cross urges eligible adults with blood types O, A negative, and B negative blood types to make Power Red donations."
blood_transfusion,How often does someone in the United States need a blood transfusion?,"According to the National Heart, Lung, and Blood Institute, every two seconds, someone in the United States needs a blood transfusion."
blood_donation,How many lives can a single blood donation save?,"For every donation you make, you could save up to three lives."
blood_donation,How often is donating whole blood considered safe?,Donating whole blood six times a year is safe
blood_donation,How does blood donation centers ensure safety during donation?,Certified blood donation centers will use sterile equipment for every donation to eliminate infection risk.
condition,What is a pulmonary embolism?,"A pulmonary embolism (PE) is a blockage in the lung's artery caused by a blood clot, which can be a life-threatening condition."
condition,What are the risks associated with a blood clot?,Blood clots can be harmful if they form for no reason and may lead to a pulmonary embolism which can cause damage to the lungs and other organs.
treatment,What should someone do if they suspect a blood clot?,"Seek immediate medical care, as most blood clots are treatable and complications can be avoided if caught early."
risk_factor,What are some risk factors for heart attack or stroke?,"Risk factors include high levels of low-density lipoprotein (LDL) cholesterol, also known as 'bad' cholesterol, and hypertension (high blood pressure)."
risk_factor,What are some other risk factors for heart attack or stroke?,A history of heart attack or stroke and Diabetes are also risk factors.
treatment,What should you do if you have concerns about your vitamin levels or homocysteine?,Consult with your healthcare provider.
treatment,How can you lower homocysteine levels?,"Your healthcare provider may recommend dietary changes to help bring them down, maintaining a balanced and healthy diet with necessary vitamins and minerals."
risk_factor,What are the risks associated with increased levels of homocysteine during pregnancy?,"Increased levels of homocysteine during pregnancy have been associated with an elevated risk of negative pregnancy outcomes such as delivering a baby with small size for gestational age, preeclampsia, having a low birth weight baby, and intrauterine growth restriction."
risk_factor,What is the risk associated with high homocysteine levels in children?,High homocysteine levels in children are associated with various health conditions
condition,What is homocysteine?,Homocysteine is an amino acid the body uses to produce proteins.
condition,What is the desired level of Homocysteine?,Homocysteine should usually remain at low levels due to its quick breakdown by essential B vitamins.
definition,What is coagulopathy?,"Coagulopathy includes problems with hemostasis. It can occur due to a deficiency in any of the cells, enzymes, or proteins that are involved in the steps of coagulation."
cause,What causes coagulopathy?,"Coagulopathies can be inherited, or they may be acquired due to illness, organ failure, or medication."
treatment,How is coagulopathy treated?,"Treatment includes medications, procedures, injections to replace deficient clotting factors, platelet transfusions, and Vitamin K administration. Treatment is often based on close observation and blood test parameters."
symptom,What are the symptoms of coagulopathy?,People with coagulopathy have a tendency to bleed.
precaution,What precautions should be taken for someone with coagulopathy?,"Precautions include avoiding activities with a high risk of injuries, testing before surgical procedures, close prenatal care during pregnancy, and preparation for the potential of excessive blood loss during vaginal delivery or C-section."
related_condition,What other condition is related to coagulopathy?,Hypercoagulation (excess blood clotting) can occur alongside coagulopathy in severe cases such as acute trauma.
treatment,What treatments are used for DVT or PE?,Blood-thinning medicines and compression stockings can help facilitate your full recovery.
monitoring,How is recovery from DVT or PE monitored?,Your healthcare provider will request blood tests and ultrasounds to monitor you and determine if the blood clot is still in place.
condition,What is thrombophlebitis?,Thrombophlebitis is a condition where blood clots form and interfere with normal blood flow. It can occur near the skin's surface or in deeper veins.
risk_factor,What are the risk factors that cause blood to clot more easily?,"Risk factors include atherosclerosis, atrial fibrillation, cancer and cancer treatments, some genetic disorders, COVID-19, diabetes, a family history of blood clots, being overweight, pregnancy and giving birth, a serious injury to a blood vessel, some medicines (including birth control), and smoking."
risk_factor,What can cause recurrent superficial thrombophlebitis?,Superficial thrombophlebitis might recur in people with varicose veins.
condition,What is hereditary ATTR amyloidosis caused by?,"Hereditary ATTR amyloidosis is caused by inheriting a mutated transthyretin gene, which produces an unstable, misshapen protein."
protein,What is the function of transthyretin protein?,The transthyretin protein is made in the liver and normally functions to transport thyroid hormone (thyroxine) and retinol (vitamin A).
condition,What is Hyperhomocysteinemia?,High levels of homocysteine in the blood that can damage the lining of arteries.
mechanism,How does Hyperhomocysteinemia contribute to cardiovascular issues?,"High levels of homocysteine can encourage blood-clotting and contribute to atherosclerosis, leading to stiffening and thickening of artery walls."
risk,What are the potential cardiovascular events associated with Hyperhomocysteinemia?,"Arterial and venous thrombosis, pulmonary embolism, aneurysm, stroke, peripheral arterial disease (PAD), and kidney disease."
risk_factor,What factors can be enhanced by Hyperhomocysteinemia?,"The adverse effects of general risk factors for cardiovascular disease, including hypertension and smoking."
treatment,How can homocysteine levels be reduced?,"Folate and B vitamins can help reduce homocysteine levels and help prevent atherosclerosis, cardiovascular disease, and stroke."
procedure,How is blood drawn during plasmapheresis?,"A single needle is placed into a vein, and blood is drawn through the needle and sent through a plasmapheresis machine."
procedure,What happens to the blood components during plasmapheresis?,"The machine separates and collects plasma, while red and white blood cells and platelets are returned to the body with a saline solution."
condition,What is a pulmonary embolism?,"A pulmonary embolism is a life-threatening condition where a blood clot blocks blood flow into the lungs, causing pressure on the heart's right ventricle."
severity,Why is a pulmonary embolism considered a life-threatening emergency?,"Because the clot blocks blood flow into the lungs, causing pressure on the heart's right ventricle, eventually leading to excessive heart strain and death."
incidence,What is the estimated incidence of pulmonary embolism in the United States?,"Studies estimate the incidence at 1 per 1,000 people per year, equating to 200,000 to 300,000 hospital admissions per year."
mortality,How many Americans die yearly from pulmonary embolism?,"It is estimated that as many as 30,000 to 50,000 Americans die yearly from PE."
origin,Where do pulmonary embolisms typically originate?,Pulmonary embolisms almost always begin as a distant clot in the arms or legs.
progression,How does a pulmonary embolism develop?,Small pieces can break off from a distant clot and travel through the body's blood vessels. Larger fragments can lodge in the lung's blood vessels and create a pulmonary embolism.
hematology_oncology,What type of conditions are treated at hematology/oncology clinics or services?,They treat cancerous or noncancerous hematologic conditions and sometimes non-hematologic cancers.
condition,What is Deep Vein Thrombosis?,The document mentions Deep Vein Thrombosis but does not define it. It is mentioned in relation to pulmonary embolism.
condition,What is phlebitis?,"Phlebitis is an inflammation of superficial veins, often visible near the skin's surface. It can be caused by damage to the vein walls or the formation of a blood clot within the vein."
condition,What is deep vein thrombosis (DVT)?,"Deep vein thrombosis (DVT) is a condition that affects deeper veins, typically in the legs, and is more serious than phlebitis."
risk_factor,What are the risk factors for phlebitis?,"Risk factors for phlebitis include varicose veins, placement of a peripheral intravenous catheter (PIVC), thrombophilia (a blood clotting disorder), autoimmune connective tissue diseases, and cancer."
risk_factor,What are the risk factors for SVT?,"Risk factors for SVT include older age (average age 60), being female, higher body weight, and a history of varicose veins."
cause,What are some causes of phlebitis?,"Phlebitis can be caused by damage to the vein walls, development of a blood clot within the vein, or both. PIVC placement is a common trigger."
symptom,What are the symptoms of phlebitis?,Symptoms of phlebitis tend to develop progressively.
treatment,How is phlebitis treated?,Phlebitis treatment is based on the underlying cause.
device,What is a PIVC?,"A PIVC (peripheral intravenous catheter) is a type of tubing placed in a vein to deliver fluids, drugs, or blood transfusions. It can damage vein walls, triggering inflammation and potentially leading to blood clots."
process,How does a PIVC cause phlebitis?,"The placement of a PIVC damages the vein walls and triggers an inflammatory response where platelets are activated, potentially forming clots and leading to SVT."
cell,What are platelets?,"Platelets, also known as thrombocytes, are blood cells responsible for blood clotting. They can cause the formation of clots that can block superficial veins during a venous injury."
definition,What are immunoglobulins?,"Immunoglobulins, also known as antibodies, are proteins that help the body’s immune system fight infections when exposed to harmful substances (antigens). They are typically made by types of white blood cells known as plasma cells or B cells (also called B lymphocytes)."
treatment,How do compression socks help?,"Compression socks help increase pressure in the veins of the legs to prevent blood from pooling and clotting. Increased pressure forces the blood to keep moving, making it harder for a blood clot to form and break off, becoming a pulmonary embolism."
precaution,What bleeding precautions should be taken while on anticoagulants?,"Avoid alcohol, over-the-counter (OTC) medications (like aspirin), and certain foods while taking anticoagulants."
condition,What is a pulmonary embolism?,"A pulmonary embolism is a condition where a blood clot forms and breaks off, traveling to the lungs."
treatment,What breathing exercises can help after a pulmonary embolism?,Breathing exercises can help make the lungs more efficient after a pulmonary embolism. Two types of breathing exercises that may help include those focusing on the diaphragm.
statistics,What is the annual diagnosis rate of pulmonary embolism in the United States?,"About 1 in 1,000 people in the United States are diagnosed with a pulmonary embolism annually."
condition,What are some conditions that can temporarily increase the risk of blood clots?,"Septicemia or sepsis, pregnancy, after surgery, bone fracture, major physical trauma with extensive bleeding, and during hospitalization due to immobility."
condition,What is septicemia or sepsis?,A severe bacterial infection throughout the body.
treatment,How are blood clots treated in an emergency?,With medication or surgery.
prevention,What can a healthcare provider prescribe to prevent blood clots?,Medication.
prevention,How can you prevent infections?,"Washing your hands frequently, keeping cuts or wounds bandaged, exercising and eating healthy, and managing health conditions like diabetes or human immunodeficiency virus (HIV)."
prevention,When should you seek immediate medical help regarding infections?,If an infection gets worse or you suspect sepsis.
treatment,What are some cancer therapies that utilize white blood cells?,Checkpoint inhibitors and cell therapies.
test,What test is used for evaluating cancerous white blood cell counts?,Flow cytometry.
system,What is the role of the lymphatic system?,"It collects fluids from cells and tissues and helps them re-enter the bloodstream. It also helps to create and store lymphocytes, white blood cells that play a role in immunity and helps send white blood cells where they need to go to fight infection."
organ,What organs are part of the lymphatic system?,"The bone marrow, spleen, thymus, lymph nodes, tonsils, and lymphatic vessels."
condition,What does a high white blood cell count indicate?,"It is a sign that the body is under stress, and there may be an infection, injury, or other stressors on the body."
condition,What is Lymphangitis?,"It is a condition that can spread within hours and can lead to life-threatening complications, such as sepsis, if not treated."
action,What action should be taken if lymphangitis symptoms are noticed?,See a healthcare provider or go to the emergency room as soon as possible.
definition,What is hemoglobin?,Hemoglobin is a protein in red blood cells that transports oxygen and removes carbon dioxide.
diagnosis,How is bacteremia diagnosed?,Bacteremia is diagnosed with blood cultures.
procedure,How are blood cultures taken?,"Four tubes of blood are taken from two separate sites, such as the left and right arm, into anaerobic and aerobic tubes. The tubes are kept in a temperature-controlled environment for at least five days."
diagnosis,What is blood poisoning?,Blood poisoning can refer to either bacteremia or sepsis.
risk_factor,What are the risk factors for developing sepsis?,"Being immunocompromised, on immunosuppressant medications, having kidney disease, diabetes, cancer, being under 1 year old, age 65 or older, or previous hospitalization for infection."
treatment,What is done if bacteria are found in blood cultures?,Testing can be performed to determine which antibiotics will work.
condition,What is post-thrombotic syndrome?,Post-thrombotic syndrome is a complication experienced by some people who’ve had a DVT (deep vein thrombosis).
symptoms,What are the symptoms of a DVT?,Symptoms like pain and swelling in the area where the blockage happens.
diagnosis,When is post-thrombotic syndrome diagnosed after a DVT?,Post-thrombotic syndrome might be diagnosed three months to two years after the initial DVT.
blood_cells,What are granulocytes?,Granulocytes are specialized white blood cells that are produced in the bone marrow.
blood_test,How are granulocytes typically checked?,Granulocytes are typically checked as part of a complete blood count (CBC) blood test.
granulocyte_levels,What can high immature granulocyte levels indicate?,"High immature granulocyte levels can be a sign of a problem with your bone marrow, infections, allergic reactions, or inflammation from an underlying health condition."
granulocyte_levels,When can high granulocyte levels be considered normal?,High immature granulocyte levels can be normal during pregnancy and in newborns.
white_blood_cells,What are the types of white blood cells included as granulocytes?,"The white blood cells included are neutrophils, basophils, and eosinophils."
basophils,What is the role of basophils?,Basophils help with responding to allergies and inflammation in the body and play an important role in recruiting other immune cells.
basophils,How do basophils cause inflammation?,Basophils cause inflammation by releasing histamine molecules and other chemical messengers that signal immune cells to respond.
basophils,What can an overactive immune response from basophils cause?,"In response to an allergen, basophils may cause an overactive immune response that can be life-threatening (anaphylaxis)."
basophils,When can basophil levels be abnormally high?,Basophil levels can also be abnormally high in a condition called chronic myeloid leukemia.
eosinophils,What is the role of eosinophils?,"Eosinophils are responsible for managing chronic inflammation and parasitic infections in the body. They can be involved in the response of the body to allergies, cancer, and parasites."
eosinophils,What is one of the main tasks of eosinophils?,Eosinophils are one of the main cells tasked with removing parasites from the body.
risk_factors,What are the risk factors for developing methemoglobinemia?,"Genetic problems, environmental factors, lung disease, heart disease, and anemia."
symptoms,How do people with methemoglobinemia react to oxygen?,People with methemoglobinemia don't improve when given pure oxygen to breathe.
diagnosis,What are some tests used to diagnose methemoglobinemia?,"Arterial blood gas, co-oximetry, and pulse oximetry."
condition,What is agranulocytosis?,"A more severe disorder when granulocyte levels are extremely low, considered to be an absence of granulocytes."
condition,What are granulocytes?,A subset of white blood cells that work to control and coordinate the immune system.
condition,What conditions can blood clots cause?,"Blood clots can cause heart attack, stroke, and pulmonary embolism."
treatment,How are blood clots treated and prevented?,"Blood clots are treated and prevented with anticoagulation medications, also known as blood thinners."
medication,What are blood thinners?,Blood thinners are anticoagulation medications that treat and prevent blood clots.
process,How do blood clots form?,Blood clots form through the coagulation cascade and platelet activation.
mechanism,How do blood thinners work?,Blood thinners work by targeting steps in the coagulation cascade and platelet activation.
terminology,What is another word for blood clot?,Another word for blood clot is thrombus.
terminology,What is an embolus?,An embolus is a blood clot that has traveled to another place in the body.
example,What is an example of an embolus?,"A pulmonary embolism is an example of an embolus, where a blood clot travels from the deep veins in the leg to the arteries in the lung."
treatment,What is an effective treatment for Fanconi anemia?,Blood and bone marrow stem cell transplant have proven to be an effective treatment for Fanconi anemia.
risk,What is a risk associated with Fanconi anemia?,People with Fanconi anemia have an increased risk of developing solid tumors as they get older.
monitoring,What monitoring is needed for people with Fanconi anemia?,Lifelong screening for cancers is needed for people with Fanconi anemia.
prognosis,What does the prognosis of Fanconi anemia depend on?,A person's prognosis largely depends on the progression of their bone marrow failure and whether they go on to develop aplastic anemia.
monitoring,What related cancers should be monitored in individuals with Fanconi anemia?,It's important to monitor for the presence of related cancers such as acute myeloid leukemia and myelodysplasia.
treatment,What is a hyperbaric oxygen chamber?,A tube-like chamber where an individual breathes 100% oxygen in a pressurized environment to increase oxygen in the body and shrink air embolisms.
treatment,What is the treatment for air embolism?,"Repositioning the patient on their left side with feet elevated and head lowered, providing extra oxygen, and using a hyperbaric oxygen chamber if available."
treatment,What is Hemgenix?,"A one-time gene therapy for hemophilia B, administered as an IV infusion, that increases circulating Factor IX in the blood."
symptom,What are the symptoms that require immediate medical help after a medical procedure?,"The context mentions having symptoms after a medical procedure and to get immediate medical help, but does not specify what the symptoms are."
cause,What can air embolisms cause?,"Air embolisms can block blood flow and, in severe cases, cause a cardiac arrest leading to death."
treatment,Are alternative treatments effective for treating cancer?,Alternative treatments have not been found to be effective for treating cancer but may help people cope with the symptoms related to cancer and cancer treatments.
treatment,What are some integrative therapies offered at cancer centers?,"Integrative therapies, such as yoga, meditation, massage, acupuncture, and more, are offered at many cancer centers."
support,What support services do cancer organizations provide?,Some cancer organizations provide support groups and communities for friends and family members of people living with cancer.
disease,What is peritoneal cancer?,Peritoneal cancer can begin in the abdominal cavity or spread to the peritoneum from cancer that started elsewhere. It affects the membrane that lines the abdominal cavity.
diagnosis,Why is peritoneal cancer difficult to diagnose?,"Symptoms of peritoneal cancer are often vague, making it difficult to diagnose until the cancer is advanced."
treatment,What is the goal of cytoreductive surgery?,The goal of cytoreductive surgery is to remove all areas of cancer in the abdomen that are larger than 1 centimeter in diameter.
