q_type,question,answer
condition,What is another name for breast cysts?,Breast cysts are also called fibrocystic disease.
prevalence,How common are breast cysts in women?,About 50% of women aged 30 and over develop breast cysts.
treatment,When might a breast cyst require aspiration?,Breast cysts may require aspiration (fluid removal) if the mass is large and is causing problems.
procedure,What is the typical wait time for biopsy results?,It can take up to 72 hours to get biopsy results.
recommendation,What is recommended during the wait for biopsy results?,Maintaining your daily routine and focusing on health can be helpful during this time.
procedure,What is needed for routine breast cancer screening?,Mammograms are needed for routine breast cancer screening.
procedure,Is breast self-exam still recommended?,Breast self-exam is no longer recommended.
recommendation,What is important for women to know about their breasts?,It is important for women to know how their breasts normally look and feel.
recommendation,What should women do if they notice changes in their breasts?,Women should immediately inform their healthcare provider of any changes in their breasts.
cause,What can cause non-cancerous breast changes?,Non-cancerous breast changes can occur due to hormonal fluctuations and age.
symptom,What are some characteristics of benign breast changes?,"Some people may experience a lump in the breast that comes and goes. Others may have cyclic breast changes, with a lump in the breast after their period."
treatment,What are the benefits of early detection and care for breast cancer?,"Early detection and care for breast cancer offer several significant benefits, greatly impacting treatment outcomes and overall survival rates. Prompt intervention allows for treatment."
specialist,Who is a lymphedema therapist?,A lymphedema therapist is typically a physical therapist with special training in treating this condition.
specialist,Who is a lymphologist?,A lymphologist is often a plastic and reconstructive surgeon with expertise in treating lymphoma and other conditions of the lymphatic system.
condition,What is the most common cause of itchiness in the breasts and body during pregnancy?,Pregnancy-induced eczema.
treatment,How can pregnancy-induced eczema be treated?,With emollient-rich moisturizers.
prevention,How can vitamin D help in breast cancer?,Maintaining normal levels of vitamin D can help prevent breast cancer by keeping VDR receptors fully activated and ID1 suppressed.
risk,What is the risk of vitamin D deficiency in postmenopausal women related to breast cancer?,Postmenopausal females with vitamin D deficiency are 45% more likely to develop breast cancer than those with normal vitamin D levels.
prevention,How to prevent yeast growth under the breasts?,"Wear bras made of breathable fabric like cotton, ensure the area under the breasts is completely dry after showering and wear athletic bras made of moisture-wicking fabric during workouts and change promptly after the session."
prevention,Why is it important to wear a comfortable and supportive bra?,"Wearing a comfortable and supportive bra, even during sleep, can prevent skinfolds from trapping sweat and moisture."
genetic_testing,Should I get a genetic test for breast cancer?,"There isn't one right answer. Your other risk factors, insurance coverage options, and personal preferences may all play a role. Talk to your healthcare provider about your concerns to determine what's best for you."
family_history,When should I discuss my family history of cancer with my doctor?,Talk to your healthcare provider if you have a family history of cancer. They should know about your family history of breast cancer now so you can make a plan together.
screening,When is breast cancer screening or genetic testing usually recommended?,Breast cancer screening or genetic testing usually are not recommended until you are over age 18.
lumps,What can cause lumps in teenage breast tissue?,"Lumps in teenage breast tissue can be from breast development, hormone shifts from your menstrual cycle, or noncancerous breast changes."
risk_factor,How does weight affect the risk of breast cancer?,"Being overweight or obese can increase the risk of breast cancer because fat tissue stores and produces estrogen, which can cause certain types of breast cancer to grow and spread."
risk_factor,Why is age a risk factor for breast cancer?,Older age is a risk factor because cells accumulate abnormal changes that lead to mutations over time.
treatment,What should you do if you suspect a breast infection or inflammation?,See your regular healthcare provider or gynecologist. You may need antibiotics or other prescription medications.
treatment,How are breast cysts and clogged milk ducts treated?,Most breast cysts and clogged milk ducts resolve on their own. Over-the-counter pain relievers and warm compress can help ease the pain. A lump in the breast should always be checked by a healthcare provider.
patient_experience,What should a patient do if they feel their healthcare provider is minimizing their pain concerns?,"If you don't feel heard and respected, look for another provider."
condition,What is vaginismus?,Vaginismus is a condition where vaginal muscles spasm. It can make it difficult to have sex and can also cause pain.
condition,What are Bartholin cysts?,"Bartholin cysts occur in moisture-secreting glands, called Bartholin glands, situated on each side of the vaginal opening. A cyst may not be noticed until it becomes infected, causing a painful, pus-filled abscess."
treatment,What treatment may be required for symptomatic Bartholin cysts?,Symptomatic cases may require antibiotics and medical intervention.
condition,When should a patient see a gynecologist for vaginal swelling?,See a gynecologist if you are not sure what is causing vaginal swelling and it either persists or recurs.
sexual_assault,What should someone do if they have been sexually assaulted?,Reach out for help as soon as you are safe. You can call the National Sexual Assault (RAINN) Hotline at 800-656-HOPE (4673) or speak to a healthcare professional you trust.
treatment,What should I do if I'm prescribed an antibiotic cream for bacterial vaginosis?,"Complete the entire course of treatment as directed, even if symptoms resolve, to avoid antibiotic resistance."
treatment,What should I do if I have symptoms of an STI?,Contact your healthcare provider and do not try to treat it with a home remedy.
treatment,What are some treatments for vaginal yeast infections?,"Vaginal creams, plain yogurt applied to the vulva or vagina, or a mixture of yogurt, honey, and clotrimazole cream."
treatment,How can I soothe my skin?,Take a colloidal oatmeal bath by dissolving oatmeal into warm water and soaking for up to 20 minutes. Plain oats can also be used.
condition,What is bacterial vaginosis?,A vaginal infection caused by an overgrowth of certain bacteria.
condition,What is vaginal atrophy?,"The menopause-related thinning of vaginal tissues that causes irritation, itching, burning, dryness, inflammation, and painful intercourse."
condition,What causes vaginal yeast infections?,Typically caused by a fungus known as Candida albicans.
prevention,Why should I avoid sharing a vaginal applicator?,Sharing a vaginal applicator increases the risk of transmission of bacteria and other potentially harmful organisms.
medication_storage,How should I store vaginal creams?,Most vaginal creams can be stored at room temperature away from heat and moisture. Some prescription creams are for one use only. Always check the expiration date and dispose of expired products.
medication_use,What is the use of vaginal creams?,"Vaginal creams are available over-the-counter (OTC) and by prescription for different purposes, including the treatment of vaginal yeast infection, vaginal atrophy, and bacterial vaginosis."
bacteria,What is the role of lactobacilli in vaginal health?,"Lactobacilli produce lactic acid, creating an acidic environment that prevents harmful bacteria from growing."
antibiotics,How can antibiotics affect vaginal health?,"Antibiotics can kill both harmful and beneficial bacteria, increasing vaginal pH and allowing pathogens to grow, potentially leading to bacterial vaginosis or yeast infections."
conditions,What conditions can result from an imbalance in vaginal bacteria?,An imbalance in vaginal bacteria can lead to bacterial vaginosis (BV) or yeast infections caused by Candida albicans.
discharge,What is vaginal discharge?,"Vaginal discharge is fluid produced by the uterus, cervix, and vagina, often containing menstrual blood."
hydration,How does hydration affect vaginal health?,Drinking plenty of water helps flush toxins and regulate the vaginal ecosystem. Dehydration can lead to itching or worsen yeast infections.
hydration,What are signs that you need more water?,"Signs of dehydration include feeling thirsty, having yellow/dark yellow/orange urine, being overly tired, feeling hungry often, having flaky or dry skin, and bad breath."
diet,How can natural sugars affect vaginal pH?,"Natural sugars from fruit can affect vaginal pH, so it's important to monitor their impact and adjust consumption as needed."
fertility,Do fibroids increase the chance of miscarriage?,"No, a high-quality study found that the presence of fibroids did not increase the chance of miscarriage."
treatment,What is the preferred surgical procedure to remove fibroids for those who wish to preserve their fertility?,A myomectomy is the preferred surgical procedure to remove fibroids among those who wish to preserve their fertility.
diagnosis,What are uterine fibroids?,"A fibroid is a benign tumor made of muscle cells (myocytes) and collagen that can develop in different areas of the uterus. They can appear as a single tumor, or you can have multiple fibroids at once."
classification,What are the other names for fibroids?,Fibroids are also called myomas or leiomyomas.
location,Where do fibroids commonly develop?,"Fibroids commonly develop on the inside of the uterus. They can also grow on the outer uterus, known as pedunculated fibroids, which are attached by a stalk."
size,What is the size range of fibroids?,Fibroids can be as small as a grain of rice or bigger than a baseball.
symptom,Do fibroids always cause symptoms?,Fibroids can be symptomatic or cause no symptoms (asymptomatic).
procedure,What is uterine artery embolization (UAE)?,"Uterine artery embolization (UAE), also known as uterine fibroid embolization, is a minimally invasive procedure that may reduce fibroid symptoms. A catheter is used to inject embolic agents into the arteries to block blood supply to fibroids, causing them to shrink or die."
procedure_success,What is the success rate of uterine artery embolization (UAE)?,Uterine artery embolization has a high success rate. Over 91% of females report a reduction in symptoms following UAE.
procedure_results,What are the results of uterine artery embolization (UAE)?,"Following UAE, patients report a reduction in symptoms including heavy menstrual bleeding, anemia, and pelvic pain. A study showed a 73% reduction in fibroids one year after the procedure."
supplements,Which supplements may help reduce the risk of fibroids?,"Vitamin D3 supplements may be effective in reducing the risk of fibroids. Vitamins A, B3, C, E, and K have also been identified for their potential to slow fibroid growth."
emergency_symptoms,When should I call 911 or go to the emergency room related to fibroid symptoms?,"Call 911 or go to the emergency room if you experience heavy bleeding, bleeding that occurs in the second or third trimester, lightheadedness or dizziness, abdominal pain, or pelvic pain. Also go if bleeding becomes very heavy, filling a pad in an hour or less."
symptoms_management,How can fibroid symptoms be managed?,"Lifestyle changes, over-the-counter medications, and supplements can help ease symptoms. Some complementary and alternative treatments may limit fibroid growth and decrease the risk of developing new fibroids."
natural_treatment,Can fibroids be shrunk naturally?,"There is little data to support methods to shrink fibroids naturally. However, some steps can be taken to slow fibroid growth and prevent future fibroids."
fibroid_growth_factors,What factors drive fibroid growth?,"Fibroid growth is driven by factors outside your control, such as genetics. While focusing on a nutrient-dense diet, getting enough exercise, and ensuring optimal vitamin D levels are great for your general health, you may still need additional prescription or procedural interventions to treat your fibroids."
treatment,What preventative measures can be taken to lower yeast infection risk during antibiotic treatment?,"Taking yeast infection medication, such as Diflucan, with your antibiotic."
transmission,Is bacterial vaginosis (BV) considered a sexually transmitted infection?,"No, BV is not generally thought of as a sexually transmitted infection, but it may be associated with sexual activity."
transmission,What precautions should be taken regarding sexual activity during trichomoniasis treatment?,Avoid sex or use condoms until treatment has been successful to prevent passing the infection back and forth.
treatment,What are some benefits of boric acid suppositories for vaginal health?,Boric acid suppositories have anti-microbial and anti-fungal activity and can help reduce the risk of recurrent infections. They may be more effective than some antifungals for treating yeast infections.
treatment,What conditions may boric acid suppositories be recommended for?,"Yeast infections, trichomoniasis, and bacterial vaginosis."
testing,What kind of at-home testing kits are available for vaginal issues?,"At-home testing kits are available for pregnancy, pH levels, vaginal flora, and STIs."
treatment,How is Bacterial Vaginosis (BV) typically treated?,BV is most often treated with antibiotics in pill form.
condition,What is vulvovaginitis?,"Vulvovaginitis is an infection or swelling in the vagina or the vulva (external genitalia). It is an umbrella term that includes BV, trichomoniasis, and yeast infections."
treatment,Should green discharge be treated at home?,"No, green discharge should not be treated at home because it is often caused by a bacterial infection that requires diagnosis and treatment by a healthcare provider. Treatment often includes prescription antibiotics."
symptom,When is vaginal discharge considered excessive and concerning?,"A significant and persistent increase in discharge beyond what's normal for an individual may be concerning. Contact a healthcare provider if you have excessive discharge that lasts more than 24 hours, or is accompanied by unusual symptoms like a strong odor or pain."
complications,What can happen if green discharge is left untreated?,"Untreated conditions causing green discharge can lead to dangerous, long-term complications."
risk_factor,What are the risk factors for bacterial vaginosis (BV)?,"Douching regularly, having multiple sex partners, not using condoms, smoking, having vaginal sex with women, and pregnancy. BV is also more prevalent in Black and Hispanic populations."
treatment,What medications are used to treat bacterial vaginosis?,"Medications are prescribed as pills taken orally or as vaginal creams or gels. Sometimes, both oral and vaginal medicines are prescribed simultaneously, especially for recurring infections."
exam_prep,What should I avoid before a vaginal exam?,Avoid scheduling the exam while on your period. Do not have sexual intercourse for at least 24 hours before the exam. Do not douche for 24 hours before your exam. Avoid using vaginal sprays or other irritants. Do not use tampons or put anything in your vagina before the appointment.
diagnosis,What are the criteria for diagnosing bacterial vaginosis?,"Three of the four criteria must be met: pH above 4.5, thin increased vaginal discharge, a fishy odor when 10% potassium solution is added to the discharge sample, and 20% or greater clue cells (fuzzy-looking cells that indicate bacteria)."
testing,What other tests are done if BV is suspected?,"If BV is suspected, healthcare providers will also check for STIs by testing the vaginal sample or taking a blood or urine sample."
complication,Why are STI checks important when BV is suspected?,"Getting STIs is easier with BV, and both infections can be present simultaneously."
infertility,Is the infertility caused by Depo-Provera permanent?,"No, the infertility caused by Depo-Provera is temporary. In most cases, ovulation returns within two years."
iud_pregnancy,What should I do if I think I am pregnant with an IUD?,Contact your healthcare provider immediately. Pregnancy with an IUD can be dangerous.
iud_pregnancy_risks,What are the risks of pregnancy with an IUD?,"Pregnancy with an IUD can be dangerous for both the woman and the fetus, and may result in an ectopic pregnancy."
ectopic_pregnancy,What is an ectopic pregnancy?,"An ectopic pregnancy is when the egg attaches to tissue outside of the uterus, such as the fallopian tubes. It can be dangerous if not terminated."
ectopic_pregnancy_symptoms,What are some symptoms of an ectopic pregnancy?,"Some symptoms include missed period, tender breasts, nausea, and others."
pregnancy_termination,How can a pregnancy be terminated?,Pregnancies can be terminated with medication (within the first 10 weeks) or surgery (after the first 10 weeks).
continue_pregnancy_iud,What happens if I want to continue a pregnancy with an IUD?,"A healthcare professional will likely remove the IUD, but the pregnancy will still be considered high risk."
depo_provera_effectiveness,How effective is Depo-Provera at preventing pregnancy?,Depo-Provera is more than 99% effective at preventing pregnancy.
depo_provera_mechanism,How does Depo-Provera work?,Depo-Provera contains a hormone that stops the ovaries from releasing an egg.
depo_provera_administration,How often is Depo-Provera administered?,It is given by a healthcare provider every three months.
medication,What is Opill?,Opill is a progestin-only oral contraceptive.
medication_availability,Is Opill available over the counter (OTC)?,"Yes, Opill is the first and only birth control pill available without a prescription."
medication_usage,When can the minipill be used?,"The minipill can be used immediately after giving birth, having an abortion, or miscarrying."
medication_missed_dose,What should I do if I miss one Opill pill?,Take it as soon as you notice.
medication_missed_dose,What should I do if I miss two Opill pills?,"Take the most recent missed pill as soon as possible, then resume taking the remaining pills at your usual time (even if it means taking two pills on the same day). Use backup contraception or avoid intercourse for seven days."
medication_missed_dose,What should I do if I miss three or more Opill pills?,Throw out the pack and restart with a new pack. Use backup birth control for at least seven days.
medication_consultation,Should I talk to my doctor before starting birth control?,"Yes, it's a good idea to speak with your healthcare provider before starting a birth control method, even if it doesn't require a prescription."
history,When was the first birth control clinic opened in America?,"In 1916, Margaret Sanger opened the first birth control clinic in America."
development,What was the initial research for birth control pills focused on?,"The initial search for safe and effective birth control pills began in 1950, led by Margaret Sanger and Katharine Dexter McCormick."
discovery,What was the key discovery that led to the development of the birth control pill?,American chemist Russell Marker discovered that Mexican women used Barbasco root for contraception and was able to extract progestin from it.
hormone,What hormone was extracted from the Barbasco root?,"Progestin, a synthetic form of progesterone, was extracted from the Barbasco root."
composition,What hormones are combined to formulate the first birth control pill?,Progestin and estrogen were combined to formulate the first birth control pill.
postpartum,Can progestin-only pills be taken after childbirth?,"Yes, progestin-only pills can be taken immediately after childbirth."
breastfeeding,Can progestin-only pills be taken while breastfeeding?,"Yes, progestin-only pills can be taken while breastfeeding."
cardiovascular_risk,Do progestin-only pills increase the risk of high blood pressure or cardiovascular disease?,"No, progestin-only pills do not increase the risk of high blood pressure or cardiovascular disease."
blood_clots,Can women with a history of high blood pressure or blood clots take progestin-only pills?,"Yes, women with a history of high blood pressure or blood clots can take progestin-only pills."
age_safety,Are progestin-only pills safer for women over 35 or who smoke?,"Yes, progestin-only pills are considered safer for women over 35 or who smoke."
prescription,Are all progestin-only pills available by prescription?,Some progestin-only pills are available without a prescription.
side_effects,Do progestin-only pills have fewer side effects?,"Yes, progestin-only pills may have fewer side effects such as nausea and headache."
fda_approval,When did the FDA approve Opill (norgestrel) for over-the-counter sale?,The FDA approved Opill (norgestrel) for over-the-counter sale in July 2023.
otc_pill,Is Opill the first over-the-counter birth control pill?,"Yes, Opill is the first and only birth control pill available without a prescription."
consultation,Is it recommended to speak with a healthcare provider before starting a birth control method?,"Yes, it's a good idea to speak with a healthcare provider before starting a birth control method, even if it doesn't require a prescription."
off_label_use,What was an early off-label use of birth control pills?,Birth control pills have been used off-label to treat acne for years.
fda_approval_acne,When did the FDA approve a birth control pill for acne treatment?,The FDA approved a combination birth control pill to treat moderate acne in women in 1997.
other_uses,What other conditions are birth control pills now used to treat?,"Birth control pills are now used to treat endometriosis, polycystic ovarian syndrome, irregular periods, and more."
birth_control_types,What are the different categories of combination birth control pills?,"Combination birth control pills are categorized as monophasic, biphasic, or triphasic."
hormone_levels,How do hormone levels change in different types of birth control pills?,"In monophasic pills, hormone levels stay the same for the first three weeks. In biphasic and triphasic pills, hormone levels change during the first three weeks of the menstrual cycle. Multiphasic birth control pills have differing amounts of hormones designed to be taken at specific times."
placebo_pills,What are placebo pills in a birth control pack?,"In a 28-day pill pack, the pills for the fourth week are usually placebo pills and do not have any hormones."
hormone_types,What hormones are contained in birth control pills?,"Birth control pills contain either estrogen and progestin, or only progestin."
pill_timing,How often should birth control pills be taken?,Combination birth control pills or progestin-only pills should be taken at the same time each day.
ovulation_prevention,How do birth control pills prevent pregnancy?,Birth control pills prevent you from ovulating.
missed_pill,What happens if you forget to take a birth control pill?,"If you forget to take your pill one day, it could lose its effect because you might not have enough of the hormones in your system to suppress ovulation that month."
triphasic_hormone_change,How do hormone levels change in triphasic birth control pills?,"Triphasic birth control pills may have a slow increase in estrogen, and some pills may also increase the dose of progestin."
multiphasic_development,When were multiphasic birth control pills developed?,Multiphasic birth control pills were developed during the 1980s.
medication,What is mifepristone?,Mifepristone is a drug that has been subject to legal challenges regarding its availability and FDA approval.
contraception,What are some long-acting reversible contraception (LARC) options?,Long-acting reversible contraception (LARC) options include intrauterine devices (IUDs) and hormonal implants.
contraception,What are the types of IUDs?,"There are copper IUDs, which do not contain hormones, and hormone-releasing IUDs."
contraception,How long can copper IUDs stay in place?,Copper IUDs can stay in place for up to 10 years.
contraception,How long can hormone-releasing IUDs stay in place?,Hormone-releasing IUDs can be left in place for up to five years.
contraception,What are some examples of hormonal implants?,Examples of hormonal implants include Implanon and Nexplanon.
contraception,How long are hormonal implants effective?,Hormonal implants are effective for three years.
contraception,What is the risk if birth control pills are missed?,"Missing one birth control pill may not increase your risk of pregnancy, depending on the type of pill."
contraception,What should be considered if birth control pills are frequently missed?,"If you frequently miss pills, you might consider a long-acting reversible contraception (LARC) such as an intrauterine device (IUD) or hormonal implant."
treatment,What are some discharge instructions following an asthma attack?,Avoid allergy triggers and follow up with their provider to adjust the asthma plan as needed.
trigger,What are some less common triggers for asthma attacks?,"Cold and flu, sinus issues, strenuous exercise, weather changes, stress and emotional distress."
