q_type,question,answer
localized_flare,What are the characteristics of localized flares in axial spondylitis?,"Localized flares affect only one area of the body, such as the low back. Symptoms can include low-back pain, back stiffness, fatigue, and emotional symptoms. These are often perceived as increases in disease activity rather than a true flare."
research,What is the role of the gut in ankylosing spondylitis?,Research suggests the gut microbiome could be a biomarker for determining the effectiveness of ankylosing spondylitis treatment.
research_focus,What are the current research areas for ankylosing spondylitis?,Current research focuses on symptom management and ways to reverse the condition. There are over 400 studies in progress.
cure,Is there a cure for ankylosing spondylitis?,"Currently, there is no cure for ankylosing spondylitis, but there are medications to help manage symptoms."
trigger,What are some common triggers for stress in people with Ankylosing Spondylitis (AS)?,"Coping with chronic disease or illness, finances, home or school responsibilities, major life events, and work pressures."
condition,How does chronic pain from AS affect daily functioning?,Chronic pain from AS can impair a person’s daily functioning by more than 50%.
condition,What are the mental health risks associated with AS?,"People with AS have an increased risk of experiencing severe psychological distress, leading to depression and anxiety."
condition,How does the severity of AS relate to mental health?,"The more severe the disease, the more mental health is affected. For example, people with ankylosing spondylitis had a 2.21 times greater risk of depression."
treatment,How can mindfulness help people with AS?,"Mindfulness can help you stay present, gain awareness of what is happening in your body, mind, and emotions, increase your ability to manage stress, regulate your emotions, and improve your overall well-being."
treatment,What is the importance of self-care for people with AS?,Self-care is important for caring for your physical and mental health and can help you live and feel better regularly.
clinical_trial,What are clinical trials?,Clinical trials are research studies that evaluate the safety and effectiveness of interventions for a specific disease or health condition.
clinical_trial_purpose,What do researchers and healthcare providers learn through clinical trials?,"They learn if a new treatment such as a medicine, device, surgical procedure, type of exercise, or diet is effective for people with the condition."
clinical_trial_participants,Why are human volunteers important for clinical trials?,"Volunteers with specific conditions can access promising treatments before they become widely available. They also help investigators and healthcare providers make advancements in diagnosing, treating, and managing ankylosing spondylitis."
clinical_trial_benefits,What benefits do clinical trials offer to people with ankylosing spondylitis?,They offer the opportunity to try promising new treatments and different approaches to using existing therapies before they become available to the general public.
clinical_trial_risks,What are some potential risks associated with participating in clinical trials?,You may experience side effects from the new drug that are unknown before joining the trial. The new treatment may not work as intended or be better than the standard treatment. You may be required to travel to the study site a few times a week. More frequent medical appointments and tests may be required.
clinical_trial_treatment_comparison,How is a new treatment compared to the standard treatment in a clinical trial?,The standard treatment is compared to the new treatment in a randomized clinical trial. Study participants do not get to choose whether they receive the new therapy being tested or standard treatment.
clinical_trial_phases,What is the purpose of clinical trial phases?,Each phase is designed to help researchers collect data to understand how the treatment works.
fda_approval,When can researchers apply for approval from the FDA?,Once researchers have enough evidence that a treatment is safe and effective for its intended use.
symptom,What are some symptoms of a stroke?,"Weakness or numbness on your face, arm or leg, or one side of your body, confusion or the inability to speak or understand others, blurred vision or other problems seeing normally, an inability to walk normally or maintain balance or coordination, severe headache without a known cause."
condition,What is ankylosing spondylitis (AS)?,"AS is a progressive condition that causes back pain and stiffness, with periods of flare-ups and remission."
symptom,What are some symptoms of AS?,"Back pain and stiffness, which come and go in flare-ups and remission."
treatment,What are some recommendations for improving sleep?,"Establish a nightly sleep routine, prepare a room that is cool, dark, and comfortable, avoid late-day caffeine and late-night snacks, and avoid using screens before sleep."
treatment,What are some recommendations for improving cognitive function?,"Maintain a regular workout schedule, eat a healthy diet, and record when symptoms occur."
condition,What is fibromyalgia?,"A condition characterized by pain and tenderness throughout the body, often accompanied by fatigue, sleep deprivation, memory loss, and mood disorders."
symptom,What are some symptoms of inflammation?,Chronic pain.
risk,What is the risk associated with chronic pain?,Chronic pain is linked with accelerated cognitive decline and a higher probability of dementia.
cause,What can cause poor cognitive function?,Poor sleep.
symptom,What are some symptoms that may accompany fatigue and warrant a doctor's visit?,"Unexplained weakness, constipation, dry skin, cold intolerance, unintended weight gain or loss, insomnia or disrupted sleep, headaches, medication that may cause fatigue, sadness or depression."
side_effect,What are some common side effects of cancer treatment?,"Nausea and vomiting, pain, hair loss, brain fog, and depression."
disease_risk,How does ankylosing spondylitis relate to cancer risk?,"The chronic inflammation present in ankylosing spondylitis damages DNA, which can lead to cancer over time."
cancer_type,What types of cancer are more common in people with ankylosing spondylitis?,"Upper respiratory cancer, digestive cancers, colon and rectum cancers, lung cancer, bone cancer, connective tissue cancers, melanoma and nonmelanoma skin cancers, breast cancer, testicular cancer, prostate cancer, urinary bladder cancer, kidney cancer, brain cancer, thyroid cancer, endocrine cancers, and blood cancer."
symptom,What are some general symptoms that may indicate a health issue?,"Unexplained weight loss, fatigue, fever, pain, and skin changes."
treatment,What are the goals of the new guidelines for ankylosing spondylitis?,"Reduce symptoms, improve physical function, retain the ability to work or go to school, minimize disease complications, and slow down skeletal bone damage."
treatment,How do biologics work for ankylosing spondylitis?,They work by blocking certain parts of the immune response to stop the body from attacking itself.
treatment,What are some risks associated with taking biologics for ankylosing spondylitis?,Developing an infection.
treatment,What are some treatment options for ankylosing spondylitis?,"Medications, lifestyle changes, and other medical treatments."
treatment,What is a JAK inhibitor?,"A janus kinase inhibitor, which is one of the newest medications for ankylosing spondylitis."
treatment,When are JAK inhibitors used for ankylosing spondylitis?,They are used in people who do not find relief from nonsteroidal anti-inflammatory drugs (NSAIDs) and are unable to take TNFi or IL-17 inhibitors.
gene,What are some genes linked to ankylosing spondylitis?,"ERAP1, IL1A, and IL23R."
condition,What is ankylosing spondylitis?,"Ankylosing spondylitis is a type of spondyloarthritis (SpA), a joint disease affecting the spine and sacroiliac (SI) joints in the pelvis."
symptoms,What areas of the body does ankylosing spondylitis affect?,"Ankylosing spondylitis affects the spine, sacroiliac (SI) joints in the pelvis, and the entheses (where ligaments meet bones)."
cause,What causes spondyloarthritis?,Many spondyloarthritis conditions are caused by the HLA-B27 genetic mutation.
risk,Does having the HLA-B27 mutation guarantee ankylosing spondylitis?,"No, having the HLA-B27 mutation does not necessarily mean a person will get ankylosing spondylitis."
diet,How does diet impact ankylosing spondylitis?,Choosing low-inflammatory foods may help with managing symptoms of ankylosing spondylitis.
symptoms,What symptoms should a healthcare provider be aware of in relation to fibromyalgia?,Healthcare provider should be aware of low back and hip pain in relation to fibromyalgia.
condition,What is the relationship between fibromyalgia and spondyloarthritis?,Fibromyalgia is a frequent comorbidity of spondyloarthritis conditions.
symptoms,What type of arthritis can occur with fibromyalgia and spondyloarthritis?,"Peripheral arthritis (arthritis in the large joints, such as the arms and legs) can occur with fibromyalgia and spondyloarthritis."
treatment,How does fibromyalgia impact the treatment of spondyloarthritis?,"In people with fibromyalgia and a spondyloarthritis condition, disease activity might be overestimated, leading to increased and more aggressive treatment."
prevalence,What is the estimated prevalence of coexisting fibromyalgia in axial spondyloarthritis?,The estimated prevalence of coexisting fibromyalgia in axial spondyloarthritis is 14%.
condition,What are the two main types of axial spondyloarthritis?,The two main types of axial spondyloarthritis are ankylosing spondylitis (AS) and non-radiographic axSpA (nr-axSpA).
condition,What is non-radiographic axSpA?,Non-radiographic axSpA (nr-axSpA) does not cause the same spine damage as AS but can be a precursor to AS.
diagnosis,What is the issue with fibromyalgia diagnosis in relation to spondyloarthritis?,"Misdiagnosis is a concern, as 50% of the people who fulfilled the criteria for fibromyalgia at baseline did not meet the criteria nearly two years later."
condition,What is axial spondyloarthritis (AS)?,AS is a severe form of spondyloarthritis.
prevalence,What is the prevalence of obesity in people with axial spondyloarthritis (AS)?,"A study found that 22% of subjects with AS experienced obesity, compared to 15% of the general population in the study."
diagnosis,Why is ankylosing spondylitis (AS) difficult to diagnose?,There is no specific test for AS and symptoms can slowly increase and worsen over time.
diagnosis,What tests can help detect ankylosing spondylitis (AS)?,Magnetic resonance imaging (MRI) can help detect the condition.
symptoms,How does ankylosing spondylitis (AS) differ from rheumatoid arthritis in terms of affected body parts?,"AS generally affects the back, while rheumatoid arthritis generally affects joints such as knees, wrists, and hands on both sides of the body."
diagnosis,Are women or men more likely to be misdiagnosed with ankylosing spondylitis?,More women than men with ankylosing spondylitis are misdiagnosed.
treatment,How does weight affect the treatment of AS?,"Both being overweight/obese and underweight can increase disease activity, making symptoms more severe and responses to treatment less successful."
condition,What condition is discussed in relation to assistive devices?,Ankylosing spondylitis.
treatment,What types of assistive devices are mentioned for ankylosing spondylitis?,Back braces and orthotics.
cost,What is noted about the cost of assistive devices?,"They can be expensive, and even lower-cost aids can add up quickly."
resources,Where can one find help covering the costs of assistive devices?,Charitable programs and medical equipment exchange programs.
condition,What percentage of American adults experience lower back pain?,Around 19% of American adults ages 20–65 experience lower back pain
diagnosis,What percentage of American adults with lower back pain are diagnosed with axial spondyloarthritis?,Only 1% are eventually diagnosed with axial spondyloarthritis.
treatment,When is bracing a treatment option for scoliosis?,Bracing is a treatment option for scoliosis when the condition is diagnosed while a person is still growing and their spinal curve measures between 25 and 40 degrees.
treatment_details,How long should a scoliosis brace be worn?,A scoliosis brace should be worn 16 to 23 hours per day until the person is done growing.
treatment,When is surgery a treatment option for scoliosis?,"Surgery is a treatment option for scoliosis when the curve of the spine is more than 40 degrees and continues to get worse in children, or more than 50 degrees with nerve damage in adults."
treatment,When is surgery a treatment option for ankylosing spondylitis?,"Surgery is a treatment option for ankylosing spondylitis when the condition is severe, to stabilize joints in the spine or straighten it out. Joint replacement surgery may be needed if other joints are affected."
symptom,What are some symptoms of scoliosis?,"Symptoms of scoliosis can include the head being positioned off center, one shoulder blade higher than the other, a hump on one side of the back when bending forward, uneven sides of the pelvis, arms hanging asymmetrically, ribs protruding on one side, and the body leaning to one side."
cause,What is the cause of ankylosing spondylitis?,"The cause of ankylosing spondylitis is unknown, but it is an autoimmune disorder where the body attacks its own joints and soft tissues."
risk_factor,What are some risk factors for ankylosing spondylitis?,"Risk factors for ankylosing spondylitis include being assigned male at birth, developing the condition before age 45, having a family history of AS, having other health conditions like ulcerative colitis, Crohn's disease or psoriasis, and having the HLA-B27 gene."
symptom,What are some symptoms related to gut issues?,"Symptoms include anemia, blood in the stool, high amounts of calprotectin in the stool and losing weight without trying."
cause,What is dysbiosis?,"Dysbiosis is an imbalance in the bacteria and other microbes of the digestive system, which can lead to inflammation."
condition,What is ankylosing spondylitis?,"Ankylosing spondylitis is an inflammatory arthritis that attacks the spine, causing pain, inflammation, and stiffness."
symptoms,What are the symptoms of ankylosing spondylitis?,"Symptoms include pain, inflammation, and stiffness in the spine, which can worsen during flare-ups. Fatigue is also a common symptom, often debilitating and unrelenting."
treatment,Is there a cure for ankylosing spondylitis?,"There is no known cure for ankylosing spondylitis, but treatments can help manage pain."
prevalence,How common is spondyloarthritis?,"More than 3.2 million Americans have spondyloarthritis, which includes ankylosing spondylitis."
fatigue,How does fatigue affect people with ankylosing spondylitis?,"Fatigue in AS is debilitating and unrelenting, affecting energy levels and motivation."
organization,What organization is dedicated to helping people with ankylosing spondylitis?,The Spondylitis Association of America is the largest charity organization in the United States dedicated to funding research and helping people with ankylosing spondylitis.
symptom,What are some symptoms that might indicate nerve compression in the lower back for someone with ankylosing spondylitis?,"Pain in your legs, numbness, tingling, or weakness."
symptom,What are the primary symptoms of ankylosing spondylitis?,Pain and stiffness in the lower back and/or hips.
symptom,Can leg pain be a symptom of ankylosing spondylitis?,"Yes, if the inflammation spreads to other joints."
symptom,What are some symptoms that could indicate a heart attack?,"Chest pain that won't go away, shortness of breath, or pain in your jaw or down your arm."
prevention,What lifestyle changes can lower the risk for heart conditions?,The document mentions making lifestyle changes but does not specify what those changes are.
diagnosis,What numbers should be regularly checked to monitor heart health?,"Blood pressure, cholesterol, and fat levels in the blood (triglycerides)."
condition,What is Ankylosing Spondylitis (AS)?,"AS is an autoimmune disease where the body attacks healthy tissues, mainly the spine and sacroiliac joints. It can also affect large joints in the arms and legs."
prevalence,How common is Ankylosing Spondylitis?,AS affects 1 in 200 people.
risk_factor,What are some risk factors for Ankylosing Spondylitis?,"Family history of AS, the HLA-B27 gene, and potentially environmental factors."
genetic_testing,What does the HLA-B27 gene mean in relation to AS?,"The HLA-B27 gene is found in 90% of people with AS, but having the gene does not guarantee development of AS. It increases the risk, especially with environmental or other unknown factors. It can also be linked to more severe AS symptoms."
symptom,What are some symptoms of severe AS?,Eye inflammation and uveitis (inflammation of the middle layer of tissue in the eye wall).
condition,What is Osteoarthritis (OA)?,OA occurs when there is a breakdown or damage to the joint cartilage that cushions the ends of bones.
prevalence,How common is Osteoarthritis?,An estimated 27 million Americans have OA.
symptom,What are some symptoms of Osteoarthritis?,"Pain in affected joints (especially with movement), stiffness (most noticeable after inactivity), tenderness, swelling, flexibility loss, grating sensation or popping/cracking noises, and bone spurs."
risk_factor,What is a risk factor for Osteoarthritis?,Breakdown or damage to the joint cartilage.
symptom,What is morning stiffness?,Morning stiffness is joint stiffness that occurs when you wake up. Joints lack the mobility to move smoothly through their full range of motion. It can be difficult and sometimes painful to move parts of your body.
cause,Why do joints stiffen up in the morning?,"Joints, especially arthritic ones, can naturally stiffen up from a lack of movement during sleep."
symptom,What are the severe symptoms that require emergency medical help?,"Severe joint pain, swelling, redness, fever, fatigue, dizziness, or nausea."
condition,What is ankylosing spondylitis?,Ankylosing spondylitis is an inflammatory autoimmune condition where the body's antibodies attack its own joints.
cause,What causes ankylosing spondylitis?,"The exact cause is not fully understood, but genetics and environmental triggers influence its development."
symptom,How does inactivity affect ankylosing spondylitis?,Inflammation causes joint pain and stiffness that worsens after periods of inactivity or lack of movement.
symptom,What is a hallmark symptom of ankylosing spondylitis?,Morning stiffness that lasts longer than 30 minutes and that improves with physical activity.
mental_health,What should I do if I am having suicidal thoughts due to hair loss or other reasons?,"Contact the 988 Suicide & Crisis Lifeline at 988 to connect with a trained counselor. If you are in immediate danger, call 911."
mental_health,Can hair loss impact my mental health?,"Yes, hair loss can lead to feelings of embarrassment, low self-esteem, and other types of emotional suffering."
treatment,What is the treatment for hair loss?,Treatment may involve changing medications for pain and swelling. Finding the cause of hair loss is key to solving this problem.
condition,What is ankylosing spondylitis?,"Ankylosing spondylitis is a condition that causes spinal inflammation, leading to pain and stiffness in the back, shoulders, ribs, hips, knees, ankles, and feet."
condition,How does ankylosing spondylitis affect sexual function?,"Ankylosing spondylitis can significantly affect an individual's sexual function and desire. When symptoms are not under control with treatment, sex can feel painful and overwhelming."
condition,What is hair loss known as in clinical terms?,Hair loss is known as alopecia.
condition,What is hair loss?,"Hair loss is a condition in which new hair doesn't replace the hair that falls out. It can occur as a result of several different conditions and can affect any area of the body, though it affects the scalp most often."
crisis_help,What should I do if I am in immediate distress or thinking about hurting myself?,"Call or text 988 to reach the 988 Suicide & Crisis Lifeline and connect with a trained counselor. If you or a loved one is in immediate danger, call 911."
exercise,What types of exercise are recommended for ankylosing spondylitis?,The Spondylosis Association of America recommends four types of exercise.
disease_info,What is ankylosing spondylitis?,Ankylosing spondylitis is a chronic inflammatory disease that usually strikes young adults before 30 years of age. The disease causes progressive deterioration of your physical function and professional capacity. The result can impact your social relationships and overall quality of life.
exercise_benefits,What benefits did people with ankylosing spondylitis experience from an eight-week Pilates group training program?,"They lowered disease activity and improved functional capacity, spinal mobility, core endurance, and quality of life."
fatigue,What is a common complaint of people with ankylosing spondylitis related to mental health?,"Fatigue, which is linked to depression and anxiety, is the third most common complaint of people with ankylosing spondylitis."
treatment,What treatment has been shown to reduce fatigue in people with active ankylosing spondylitis?,Treatment with Cosentyx (secukinumab) reduced fatigue in people with active ankylosing spondylitis for up to three years.
condition,What is ankylosing spondylitis?,Ankylosing spondylitis (AS) is a form of autoimmune arthritis characterized by long-term inflammation of the spine and sacroiliac joints.
symptom,What are common symptoms of ankylosing spondylitis?,"Common symptoms of AS include pain and stiffness in the spine, sacroiliac joints, neck, shoulders, ribs, hips, and heels."
anatomy,What are the different regions of the spine?,"The spine consists of cervical (neck), thoracic (mid-back), lumbar (low-back), sacral, and coccyx regions."
symptom,How does spinal pain present?,"Spinal pain can be dull and achy, or sharp and stabbing, making movements painful."
treatment,What is an osteotomy?,"An osteotomy is a procedure to reduce spinal deformity and improve spinal stability and mobility, involving cutting and realigning spinal vertebrae."
treatment,What is a laminectomy?,A laminectomy is a decompression procedure that removes a portion of the spinal vertebrae (lamina) to relieve pressure on the spinal cord and nerves.
treatment,What is spinal fusion?,"Spinal fusion is a procedure used to correct spinal deformity and provide stability to the spinal column, often using rods and/or screws to fuse vertebrae."
symptom,"What are some consequences of a fused, rigid spine?","A fused, rigid spine can lead to limited mobility and flexibility, increased risk of fractures, and potentially cauda equina syndrome."
symptom,What is kyphosis?,Kyphosis is a rounded upper back or hunchbacked posture.
condition,What is Cauda equina syndrome?,"Cauda equina syndrome occurs when nerve roots in the lower back are compressed, reducing mobility and sensation in the lower body."
symptom,How can ankylosing spondylitis affect breathing?,"Inflammation in the joints between the rib and spine can restrict chest movement, making breathing difficult."
condition,What is Ankylosing Spondylitis (AS)?,"AS is a form of axial spondyloarthritis that affects the joints of the spine, chest, and pelvis. It is also an autoimmune disease where the immune system malfunctions and attacks healthy tissues."
symptoms,What are the symptoms of Ankylosing Spondylitis (AS)?,"Symptoms include stiffness and pain in the spine and low back. It can also cause pain and stiffness in other areas, including the hips, shoulders, knees, and feet."
diagnosis,Why is early diagnosis of Ankylosing Spondylitis important?,"Early diagnosis is vital to preserving your joints and preventing disease complications that could lead to early death. The sooner you get a diagnosis, the sooner you can start treating the condition."
treatment,What should a person with AS do after diagnosis?,A person with AS should work with their healthcare provider to create a treatment plan as soon as they are diagnosed.
related_condition,What is non-radiographic axial spondyloarthritis (nr-AxSpA)?,Nr-AxSpA is another type of axial spondyloarthritis that can later progress into AS.
affected_area,What areas of the body are affected by AS?,"AS affects the joints of the spine, chest, and pelvis. It can also cause pain and stiffness in other areas, including the hips, shoulders, knees, and feet."
cause,What causes the symptoms of AS?,"AS causes inflammation of the spine. Spinal inflammation will lead to back, neck, and rib cage stiffness and pain."
genetic_risk,What gene is strongly linked to ankylosing spondylitis (AS)?,HLA-B27 is strongly linked to AS.
genetic_risk,Does having the HLA-B27 gene mutation guarantee the development of AS?,"No, it is possible to have the gene mutation and never get AS, or not have it and still get AS."
diagnosis,What test might a healthcare provider recommend if they suspect AS?,A blood test for HLA-B27 may be recommended.
treatment,How does treatment for ankylosing spondylitis vary between individuals?,"Treatment varies; some may need intensive medications or therapy, while others do well with fewer interventions."
treatment,What are some treatment options for IBS?,"Treatment for IBS may include diet and lifestyle changes, over-the-counter or prescription medication."
